<?xml version="1.0" encoding="UTF-8"?>
<!-- This file can read the data file charsep_data.csv -->

<!-- <!DOCTYPE report SYSTEM "report.dtd"> -->

<!-- All sizes are in points (72 points == 1 inch). -->

<!-- All coordinates and lengths are floating point, but may be truncated -->
<!-- by layout engines. -->

<!-- Colors are stored as "red;green;blue;alpha". Each component is an -->
<!-- integer from 0 to 255. -->

<!-- You will have to edit the image URL below. Search for "file:" -->

<report dtd-version="1.2"
	name="example1" title="Example Report" author="Jim Menard">

  <description><![CDATA[]]></description>

  <bean-scripting-framework default-language="Ruby">
    <language name="Ruby" class="org.jruby.javasupport.bsf.JRubyEngine"/>
  </bean-scripting-framework>

  <!-- Default orientation is portrait. -->
  <paper name="US-Letter" />

  <!-- Data source. In this case, a comma-separated file. This -->
  <!-- definition describes the file charsep_data.csv -->
  
  <source>

    <!-- The column names happen to be the same as database table.column -->
    <!-- names, but that's just a coincidence. OK, I'm lazy. -->
    <charsep sep-char=",">
      <!-- We need to define column names and types. For date columns, -->
      <!-- we need to define a string that will be used to parse the -->
      <!-- string so we can turn it into a java.lang.Date object -->
      <!-- Actually, you ccould skip the date-format string; the default -->
      <!-- parse string (yyyy-MM-dd) is the same string. -->
      <column name="office.name" type="string" />
      <column name="jobs.ID" type="number" />
      <column name="jobs.title" type="string" />
      <column name="jobs.hourly rate" type="number" />
      <column name="jobs.post_date" type="date" date-format="yyyy-MM-dd" />
    </charsep>

    <query>
      <where><![CDATA[{office.name} != 'Chicago']]></where>
    </query>

  </source>

  <formulas>
  <!-- Use Ruby for formula definitions. -->
  <!-- {jobs.ID} means database column jobs.ID -->
  <!-- {@1} means formula with id "1" -->
  <!-- {%report.title} means calculated value "report.title" -->

    <!-- The first formula checks for nil hourly rate. If so, it -->
    <!-- returns nil (which will become an empty NULL value). -->
    <formula id="1" name="hourly rate / 100"><![CDATA[{jobs.hourly rate}.nil? ? nil : {jobs.hourly rate} / 100.0]]></formula>
    <formula id="2" name="refs f1"><![CDATA[{@1}]]></formula>
  </formulas>

  <usercols>
    <usercol id="1" name="Short Title"><![CDATA[substr(jobs.title, 1, 8)]]></usercol>
  </usercols>

  <headers>
    <section height="42">
      <field id="15" type="image" value="file:examples/Home16.gif">
	<bounds x="8" y="8" width="16" height="16" />
      </field>
      <field id="1" type="special" value="report.title">
	<bounds x="100" y="0" width="397" height="28" />
	<format size="24" align="center" bold="true"
	    name="Helvetica" color="0;0;255;255" />
	<border>
	  <edge location="bottom" number="2" />
	  <edge location="top" number="2" />
	  <edge location="left" number="2" />
	  <edge location="right" number="2" />
	</border>
      </field>
      <field id="2" type="special" value="report.date">
	<bounds x="100" y="28" width="397" height="14" />
	<format align="center" name="Helvetica" color="0;0;255;127"
	 format="yyyy-MM-dd" />
      </field>
    </section>
  </headers>

  <footers>
    <section height="30">
      <field id="16" type="text">
	<text><![CDATA[Grand Total:]]></text>
	<bounds x="250" y="8" width="150" height="20" />
	<format align="right" size="14" bold="true" />
	<border>
	  <edge location="top" />
	</border>
      </field>
      <field id="17" type="sum" value="13"><!-- formula in field 13 -->
	<bounds x="400" y="8" width="100" height="20" />
	<format align="right" size="14" bold="true" format="$#,###.00" />
	<border>
	  <edge location="top" />
	</border>
      </field>
      <field id="21" type="special" value="report.row">
	<bounds x="500" y="8" width="20" height="20" />
      </field>
      <field id="26" type="special" value="group.count">
	<bounds x="530" y="8" width="20" height="20" />
      </field>
    </section>
  </footers>

  <page>

    <!-- page headers -->
    <headers>
      <section height="30">
	<field id="3" type="text">
	  <text><![CDATA[Job #]]></text>
	  <bounds x="10" y="0" width="40" height="20" />
	  <format align="right" bold="true" underline="true" />
	</field>
	<field id="4" type="text">
	  <text><![CDATA[Title]]></text>
	  <bounds x="70" y="0" width="320" height="20" />
	  <format align="left" bold="true" underline="true" />
	</field>
	<field id="5" type="text">
	  <text><![CDATA[Hourly Rate]]></text>
	  <bounds x="400" y="0" width="100" height="20" />
	  <format align="right" bold="true" underline="true" />
	</field>
      </section>
    </headers>

    <!-- page footers -->
    <footers>
      <section height="50">
	<field id="6" type="special" value="page.number">
	  <bounds x="475" y="0" width="90" height="20" />
	  <format align="right" italic="true" format="Page 0" />
	  <border>
	    <edge location="top" number="2"/>
	  </border>
	</field>
      </section>
    </footers>

  </page>

  <!-- group -->
  <groups>
  <group groupable-id="office.name" groupable-type="column">
    <headers>
      <section height="30">
	<field id="7" type="column" value="office.name">
	  <bounds x="0" y="0" width="250" height="20" />
	  <format align="left" size="14" bold="true" underline="true" />
	</field>
      </section>
    </headers>
    <footers>
      <section height="30">
	<field id="8" type="text">
	  <text><![CDATA[Total:]]></text>
	  <bounds x="340" y="8" width="60" height="20" />
	  <format align="right" size="14" bold="true" />
	  <border>
	    <edge location="top" />
	  </border>
	</field>
	<field id="9" type="sum" value="13"><!-- formula in field 13 -->
	  <bounds x="400" y="8" width="100" height="20" />
	  <format align="right" size="14" bold="true" format="$#,###.00" />
	  <border>
	    <edge location="top" />
	  </border>
	</field>
	<field id="22" type="special" value="report.row">
	  <bounds x="500" y="8" width="20" height="20" />
	</field>
	<field id="27" type="special" value="group.count">
	  <bounds x="520" y="8" width="20" height="20" />
	</field>
      </section>
    </footers>
  </group>
  <group column="jobs.post_date">
    <headers>
      <section height="30">
	<field id="18" type="column" value="jobs.post_date">
	  <bounds x="0" y="0" width="250" height="20" />
	  <format align="left" size="12" bold="true" underline="false" format="yyyy-MM-dd" />
	</field>
      </section>
    </headers>
    <footers>
      <section height="30">
	<field id="19" type="text">
	  <text><![CDATA[Post Date Total:]]></text>
	  <bounds x="250" y="8" width="150" height="20" />
	  <format align="right" size="14" bold="true" />
	  <border>
	    <edge location="top" />
	  </border>
	</field>
	<field id="20" type="sum" value="13"><!-- formula in field 13 -->
	  <bounds x="400" y="8" width="100" height="20" />
	  <format align="right" size="14" bold="true" format="$#,###.00" />
	  <border>
	    <edge location="top" />
	  </border>
	</field>
	<field id="23" type="special" value="report.row">
	  <bounds x="500" y="8" width="20" height="20" />
	</field>
	<field id="28" type="special" value="group.count">
	  <bounds x="520" y="8" width="20" height="20" />
	</field>
      </section>
    </footers>
  </group>
  </groups>

  <!-- details -->
  <details>
    <section height="20">
      <field id="10" type="column" value="jobs.ID">
	<bounds x="10" y="0" width="40" height="20" />
	<format align="right" />
      </field>
      <field id="11" type="column" value="jobs.title">
	<bounds x="70" y="0" width="275" height="20" />
	<!-- Set wrap to false because tests are simple and assume -->
	<!-- entire title is on one line. -->
	<format align="left" wrap="false" />
	<border>
	  <edge location="right" />
	</border>
      </field>
      <field id="12" type="column" value="jobs.hourly rate">
	<bounds x="350" y="0" width="50" height="20" />
	<format align="right" />
      </field>
      <field id="13" type="formula" value="1">
	<bounds x="400" y="0" width="100" height="20" />
	<format align="right" format="$#,###.00"/>
      </field>
      <field id="14" type="formula" value="2">
	<bounds x="500" y="0" width="75" height="20" />
	<format align="right" format="#,###.##"/>
      </field>
      <field id="24" type="special" value="report.row">
	<bounds x="510" y="8" width="20" height="20" />
      </field>
      <field id="26" type="special" value="group.count">
	<bounds x="520" y="8" width="20" height="20" />
      </field>
    </section>
  </details>

</report>
